filename	link	title	abstract	keywords	entity_per_paragraphs	entity_per_tokens
PR06015055-CC.pdf	PR06015055-CC.pdf	The Hall effect in Zn-doped YBa 2 Cu 3 O 7−δ revisited: Hall angle and the pseudogap 	The temperature dependence of the Hall coefficient is measured with a high accuracy in a series of YBa2(Cu1−zZnz)3O6.78 crystals with 0≤z≤0.013. We found that the cotangent of the Hall angle, cot θH , starts to deviate upwardly from the T 2 dependence below T0 (∼130 K), regardless of the Zn concentration. We discuss that this deviation is caused by the pseudogap; the direction of the deviation and its insensitivity to the Zn doping suggest that the pseudogap affects cot θH through a change in the effective mass, rather than through a change in the Hall scattering rate. 		2.27777777777778	95.9512195121951
PR05003221-CC.pdf	PR05003221-CC.pdf	Hydrostatic pressure induced lattice effects in La 2−x Sr x CuO 4 	Micro-Raman measurements under hydrostatic pressures up to ∼6 GPa have been carried out on high-quality La2−xSrxCuO4 polycrystalline compounds with Sr concentration up to x=0.24. The zz scattering polarization has been investigated at room temperature, where two strong modes due to La/Sr and the apex oxygen atoms are observed. The energy of the strong modes increases almost linearly with pressure for the Sr concentrations studied. Modifications in the increment rate dω/dp have been detected depending on the amount of doping. Finally, measurements at low temperatures denote that the application of pressure minimizes the distortions of the CuO 6 octahedra. 		3.70588235294118	35.8095238095238
PR05809504-CC.pdf	PR05809504-CC.pdf	Synthesis and superconductivity of F-free NdFeAsO 1-y Synthesis and superconductivity of F-free NdFeAsO 1-y 	We have synthesized a series of oxygen-deficient, fluorine-free polycrystalline samples with nominal chemical formula NdFeAsO 1-y using high-pressure technique and its phase diagram is figured, which shows the distinguishable boundary between superconducting and non-superconducting state. The a-and c-parameters were contracted with increase in the oxygen deficiency. When the a-parameter is reduced to 3.964 Å from that of non- superconducting sample, the superconductivity is induced with an abrupt raise of T c and the T c saturates about 53 K at a=3.94 ~ 3.95 Å. 		3.47058823529412	34.864406779661
PR05514733-CC.pdf	PR05514733-CC.pdf	New features in the microwave response of Y Ba 2 Cu 3 O 6.95 crystals : Evidence for a multi-component order parameter 	New features are reported in precision measurements of the complex microwave conductivity of high quality Y Ba2Cu3O6.95 crystals grown in BaZrO3 crucibles. A third peak in the normal conduc- tivity, σ1(T ), at around 80K, and enhanced pair conductivity σ2(T ) below ∼ 65K are observed. The data are inconsistent with a single order parameter, and instead are indicative of multi-component superconductivity. Overall, these results point to the presence of multiple pairing interactions in Y Ba2Cu3O6.95 and also provide a natural explanation to account for the low temperature 35K conductivity peak observed in all Y Ba2Cu3O6.95 crystals. 		3.72727272727273	40.9512195121951
PR05703245-CC.pdf	PR05703245-CC.pdf		Tunneling conductance of normal metal / d x 2 −y 2 -wave superconductor junctions in the presence of broken time reversal symmetry states near interfaces In order to clarify the influence of (the presence of) the broken time-reversal symmetry state (BTRSS) induced near the interface, tunneling conductance spectra in normal metal / d x 2 −y 2 -wave superconductor junctions are calcu- lated on the basis of the quasiclassical Green's function method. The spatial dependence of the pair potential in the superconductor side is determined self-consistently. We discuss two types of the symmetry on the BTRSS; i) d x 2 −y 2 +is-wave state and ii) d x 2 −y 2 +id xy -wave state. It is shown that the am- plitude of the subdominant component (is-wave or id xy -wave) is quite sensitive to the transmission coefficient of the junction. As the results, the splitting of the zero-bias conductance peak due to the BTRSS inducement is detectable only at junctions with small transmission coefficients for both cases. When the transmission coefficients are relatively large, the explicit peak splitting does not occur and the difference in the two cases appears in the height of the zero-bias peaks. 		0.189189189189189	1172.71428571429
PR06103604-CC.pdf	PR06103604-CC.pdf	Specific Heat of Zn-Doped YBa 2 Cu 3 O 6.95 : Possible Evidence for Kondo Screening in the Superconducting State 	The magnetic field dependence of the specific heat of Zn-doped single crystals of YBa2Cu3O6.95 was measured between 2 and 10 K and up to 8 Tesla. Doping levels of 0, 0.15%, 0.31%, and 1% were studied and compared. In particular we searched for the Schottky anomaly associated with the Zn-induced magnetic moments. 		3.26315789473684	87.741935483871
PR06100107-CC.pdf	PR06100107-CC.pdf	Role of two-dimensional electronic state in superconductivity in La 2−x Sr x CuO 4 	We have measured out-of-plane resistivity ρc for La2−xSrxCuO4 under anisotropic pressure. c-axis compression, which decreases ρc, reduces Tc drastically, whereas c-axis extention, which increases ρc, enhances Tc from 38K at ambient pressure to 51.6K at 8GPa. We find that the variation of Tc scales as a function of ρc, and that the c-axis pressure coefficient is much stronger than the ab-axis one. These imply that Tc depends primarily on the interlayer, rather than the in-plane, lattice parameter. 		6.61904761904762	28.0143884892086
PR05814581-CC.pdf	PR05814581-CC.pdf	Anisotropic renormalized fluctuations in the microwave resistivity in YBa 2 Cu 3 O 7−δ 	We discuss the excess conductivity above Tc due to renormalized order-parameter fluctuations in YBa2Cu3O 7−δ (YBCO) at microwave frequencies. We calculate the effects of the uniaxial anisotropy on the renormalized fluctuations in the Hartree approximation, extending the isotropic theory de- veloped by Dorsey [Phys. Rev. B 43, 7575 (1991)]. Measurements of the real part of the microwave resistivity at 24 and 48 GHz and of the dc resistivity are performed on different YBCO films. The onset of the superconducting transition and the deviation from the linear temperature behavior above Tc can be fully accounted for by the extended theory. According to the theoretical calculation here presented, a departure from gaussian toward renormalized fluctuations is observed. Very con- sistent values of the fundamental parameters (critical temperature, coherence lenghts, penetration depth) of the superconducting state are obtained. 		4.63157894736842	65.8977272727273
PR04909084-CC.pdf	PR04909084-CC.pdf	Superconductor-to-Metal Quantum Phase Transition in Overdoped La 2-x Sr x CuO 4 	We investigate T c and magnetic penetration depth λ(T) near the superconductor-metal quantum phase transition in overdoped La 2-x Sr x CuO 4 films. Both T c and superfluid density n s ,  λ -2 , decrease with overdoping. They obey the scaling relation T c  [λ -2 (0)] α with α  ½. We discuss this result in the frameworks of disordered d-wave superconductors and of scaling near quantum critical points. Our result, and the linear scaling (α  1) found for the more anisotropic T 2 Ba 2 CuO 6+δ , can both be understood in terms of quantum critical scaling, with different dimensionalities for fluctuations. 		2.67741935483871	37.3012048192771
PR06006991-CC.pdf	PR06006991-CC.pdf	"Non-Universal Power Law of the ""Hall Scattering Rate"" in a Single-Layer Cuprate Bi 2 Sr 2−x La x CuO 6 "	"In-plane resistivity, Hall coefficient, and magnetoresistance (MR) are measured in a series of high- quality Bi2Sr2−xLaxCuO6 crystals with various carrier concentrations, from underdope to overdope. It is found that the temperature dependence of the Hall angle obeys a power law T α with α system- atically decreasing with increasing doping, which questions the universality of the Fermi-liquid-like T 2 dependence of the ""Hall scattering rate"". The systematics of MR indicates an increasing role of spin scattering in underdoped samples. "		6.92307692307692	35.8444444444444
PR05903948-CC.pdf	PR05903948-CC.pdf	Charge Localization from Local Destruction of Antiferromagnetic Correlation in Zn-doped YBa 2 Cu 3 O 7−δ 	"The in-plane normal-state resistivity of Zn-doped YBa2Cu3O 7−δ single crystals is measured down to low temperatures by suppressing superconductivity with magnetic fields up to 18 T. Substitution of Cu with Zn in the CuO2 planes is found to induce carrier localization at low temperatures in ""clean"" samples with kF l > 5, where the mean free path l is larger than the electron wave length and thus localization is not normally expected. The destruction of the local antiferromagnetic correlation among Cu spins by Zn is discussed to be the possible origin of this unusual charge localization. "		3.23529411764706	70.9636363636364
PR06013094-CC.pdf	PR06013094-CC.pdf	Pressure effects on the superconducting properties of YBa 2 Cu 4 O 8 	Measurements of the magnetization under high hydrostatic pressure (up to 10.2 kbar) in YBa2Cu4O8 were carried out. From the scaling analysis of the magnetization data the pressure induced shifts of the transition temperature Tc, the volume V and the anisotropy γ have been ob- tained. It was shown that the pressure induced relative shift of Tc mirrors essentially that of the anisotropy. This observation uncovers a novel generic property of anisotropic type II superconduc- tors, that inexistent in the isotropic case. 		6.63636363636364	34.958904109589
PR0446999-CC.pdf	PR0446999-CC.pdf		We have studied both single and polycrystalline samples of Eu 1−x K x Fe 2 As 2 with x= 0, 0.35, 0.45 and 0.5 by means of electrical resistivity, susceptibility as well as specific heat measurements. Above 40 K, the susceptibility of single crystalline EuFe 2 As 2 , measured in fields applied along and perpendicular to the c-axis, is isotropic. In addition to the antiferromagnetic (AFM) spin density wave (SDW) transition at 190 K associated with the FeAs layers, the compound undergoes another magnetic phase transition at 19 K due to AFM ordering of Eu 2+ moments. For x = 0.5, a well defined anomaly in the specific heat related to the superconducting (SC) transition at T c = 32 K confirms bulk superconductivity in this compound. The relative height of the specific-heat jump is larger than the BCS value indicating strong-coupling effects. 		8.81818181818182	21.5463917525773
PR04310568-CC.pdf	PR04310568-CC.pdf	Magnetic properties of Gd 1−x Pr x Ba 2 Cu 3 O 7−y single crystals . 	Magnetic properties were studied for the high quality Al-free orthorhombic Gd1−xPrxBa2Cu3O7−y single crystals (0 ≤ x ≤ 1.0) grown by the flux method. An indication on the interaction between the Pr and Cu(2) magnetic sublattices was found for Pr123. Different sign of magnetic anisotropy was established for the Pr and Gd ions at low T . It was also shown that superconductivity reported by Zou et al. [Phys. Rev. Lett. 80, 1074 (1998)] for Pr123 single crystals grown by TSZF method seems to be connected with partial substitution of Ba for the Pr-sites. 		2.90909090909091	31.40625
PR05914099-CC.pdf	PR05914099-CC.pdf	Coexistence of ferromagnetism and superconductivity in the hybrid ruthenate-cuprate compound RuSr 2 GdCu 2 O 8 studied by muon spin rotation (µSR) and DC-magnetization 	We have investigated the magnetic and the superconducting properties of the hybrid ruthenate- cuprate compound RuSr2GdCu2O8 by means of zero-field muon spin rotation-(ZF-µSR) and DC magnetization measurements. The DC-magnetisation data establish that this material exhibits ferromagnetic order of the Ru-moments (µ(Ru) ≈ 1 µB) below TCurie = 133 K and becomes su- perconducting at a much lower temperature Tc = 16 K. The ZF-µSR experiments indicate that the ferromagnetic phase is homogeneous on a microscopic scale and accounts for most of the sample volume. They also suggest that the magnetic order is not significantly modified at the onset of superconductivity. 		5.93548387096774	43.8532608695652
PR05514152-CC.pdf	PR05514152-CC.pdf	In-plane optical response of Bi 2 Sr 2 CuO 6 	We report on infrared reflectivity measurements of the ab-plane response of superconducting Bi 2 Sr 2 CuO 6 single crystals. The frequency dependent con- ductivity has a maximum near 500 cm −1 at room temperature, which shifts to lower frequency and merges with a Drude peak below 100 K. We attribute the unusual behavior of the mid-infrared conductivity to low frequency tran- sitions between electronic bands of mainly BiO character near the M point. The linear temperature dependence of the low-frequency resistivity can be followed down to approximately 40 K where it saturates. 		3.16666666666667	57.3333333333333
PR05511832-CC.pdf	PR05511832-CC.pdf		Using a mean-field BCS-like approach on the bidimensional extended Hubbard Hamiltonian we calculate the superconducting transition temperature T c as a func- tion of the hole content n h . This method can be used to determine the critical temperatures T c either for the extended − s wave or d wave symmetry. We can also describe the pressure effects on T c by introducing the assumption that it induces a change in the magnitude V of the attractive potential. This assumption yields an explanation for the intrinsic term, and together with the well known change in n h , we set the critical temperature as T c = T c (n h (P ), V (P ). Then, we obtain a general expansion of T c in terms of the pressure P and the hole content n h . We apply this expansion to the T l 0.5 P b 0.5 Sr 2 Ca 1−x Y x Cu 2 O 7 system (0.0 ≤ x ≤ 0.35) and our results provide a good fitting for the experimental data for the variation of T c with the pressure P and n h . 		2.1	61.6984126984127
PR05713422-CC.pdf	PR05713422-CC.pdf	Systematic behaviour of the in-plane penetration depth in d-wave cuprates 	We report the temperature T and oxygen concentration dependences of the penetration depth of grain-aligned YBa2Cu3O 7−δ with δ= 0.0, 0.3 and 0.43. The values of the in-plane λ ab (0) and out- of-plane λc(0) penetration depths, the low temperature linear term in λ ab (T), and the ratio λc(0) /λ ab (T) were found to increase with increasing δ. The systematic changes of the linear term in λ ab (T) with Tc found here and in recent work on HgBa2Can−1CunO 2n+2+δ (n = 1 and 3) 1 are discussed. 		7.15384615384615	39.6129032258064
PR05907184-CC.pdf	PR05907184-CC.pdf	Temperature Evolution of the Pseudogap State in the Infra-Red Response of Underdoped La 2−x Sr x CuO 4 	The ab-plane optical spectra of two single crystals of underdoped La2−xSrxCuO4 were investigated. The reflectivity of La1.87Sr0.13CuO4 has been measured in the frequency range 30 -9,000 cm −1 (0.004 -1 eV) both parallel and perpendicular to the CuO2 planes, whereas La1.86Sr0.14CuO4 was studied only in the ab-plane. The extended Drude model shows that the frequency-dependent effective scattering rate 1/τ (ω, T ) is strongly suppressed below the high-frequency straight-line ex- trapolation, a signature of the pseudogap state. This suppression can be seen from temperatures below the superconducting transition up to 400 K. In the case of underdoped LSCO the straight-line extrapolation is temperature independent below 200 K, whereas above 200 K there is a strong tem- perature dependence of the high-frequency 1/τ (ω, T ). The out-of-plane direction is also examined for evidence of the pseudogap state. 		3	36.0625
PR06114350-CC.pdf	PR06114350-CC.pdf	Impurity scattering effects on the low-temperature specific heat of d-wave superconductors 	Very recently impurity scattering effects on quasiparticles in d-wave superconductors have attracted much attention. Especially, the thermodynamic properties in magnetic fields H are of interest. We have measured the low-temperature specific heat C(T,H) of La 1.78 Sr 0.22 Cu 1-x Ni x O 4 . For the first time, the impurity scattering effects on C(T,H) of cuprate superconductors were clearly observed, and are compared with theory of d-wave superconductivity. It is found that impurity scattering leads to g(H)=g(0)(1+D´(H/H c2 )´ln(H c2 /H) in small magnetic fields. Most amazingly, the scaling of C(T,H) breaks down due to impurity scattering. 		3.73333333333333	60.8035714285714
PR05814617-CC.pdf	PR05814617-CC.pdf	Anisotropic in-plane thermal conductivity of single-crystal YBa 2 Cu 4 O 8 	We report measurements of the in-plane thermal conductivity (κ) of YBa2Cu4O8 (Y-124) single crystals in the temperature range 4K ≤ T ≤ 300K and compare them with previous results on YBa2Cu3O6+x (Y-123). For transport perpendicular to the CuO chains, κa(300K) ≃ 10W/mK, and along the chains, κ b (300K) ≃ 40W/mK. The temperature dependence of κ for both transport directions is much stronger than in YBa2Cu3O6+x (Y-123), indicative of substantially superior lattice heat conduction in Y-124, and resulting in maximum values for κ at T ∼ 20K exceeding 200W/mK. The data imply a surprisingly large anisotropy in the lattice conduction. κa and κ b are enhanced in the superconducting state as in other cuprates. The magnitude and anisotropy of the enhancement are discussed and compared to those of Y-123. 		5.47368421052632	37.4519230769231
PR05909642-CC.pdf	PR05909642-CC.pdf	Doping Dependence of the Pseudogap in La 2−x Sr x CuO 4 	We report the results of Raman scattering experiments on single crystals of La2−xSrxCuO4 that span the range from underdoped (x = 0.10) to overdoped (x =0.22). The spectra are consistent with the existence of a strong anisotropic quasiparticle interaction that results in a normal state depletion of spectral weight from regions of the Fermi surface located near the zone axes. The strength of the interaction decreases rapidly with increasing hole concentration and the spectral evidence for the pseudogap vanishes when the optimum doping level is reached. The results suggest that the pseudogap and superconducting gap arise from different mechanisms. 		2.55882352941176	61.6206896551724
PR06012475-CC.pdf	PR06012475-CC.pdf	Resistive upper critical fields and irreversibility lines of optimally-doped high-T c cuprates 	We present the resistively-determined upper critical field H ρ c2 (T ) and the irreversibility lines H ρ irr (T ) of various high-Tc cuprates, deduced from measurements in 61-T pulsed magnetic fields applied par- allel to the c axis. The shape of both H ρ c2 (T ) and H ρ irr (T ) depends monotonically on the anisotropy of the material and none of the samples show saturation of H ρ (T ) at low temperatures. The anoma- lous positive curvature, d 2 H ρ /dT 2 > 0, is the strongest in materials with the largest normal state anisotropy, regardless of whether anisotropy is varied by changing the carrier concentration or by comparing a variety of optimally-doped compounds. 		4.56521739130435	38.1238095238095
PR06014617-CC.pdf	PR06014617-CC.pdf	Effects of carrier concentration on the superfluid density of high-T c cuprates 	The absolute values and temperature, T, dependence of the in-plane magnetic penetration depth, λ ab , of La2−xSrxCuO4 and HgBa2CuO 4+δ have been measured as a function of carrier concentration. We find that the superfluid density, ρs, changes substantially and systematically with doping. The values of ρs(0) are closely linked to the available low energy spectral weight as determined by the electronic entropy just above Tc and the initial slope of ρs(T )/ρs(0) increases rapidly with carrier concentration. The results are discussed in the context of a possible relationship between ρs and the normal-state (or pseudo) energy gap. 		4.25	50.1176470588235
PR06114956-CC.pdf	PR06114956-CC.pdf	Carrier concentrations in Bi 2 Sr 2−z La z CuO 6+δ single crystals and their relation to Hall coefficient and thermopower 	"We measured the thermopower S and the Hall coefficients RH of Bi2Sr2−zLazCuO 6+δ (BSLCO) single crystals in a wide doping range, in an effort to identify the actual hole concentrations per Cu, p, in this system. It is found that the ""universal"" relation between the room-temperature thermopower and Tc does not hold in the BSLCO system. Instead, comparison of the temperature- dependent RH data with other cuprate systems is used as a tool to identify the actual p value. To justify this approach, we compare normalized RH(T ) data of BSLCO, La2−xSrxCuO4 (LSCO), YBa2Cu3Oy, and Tl2Ba2CuO 6+δ , and demonstrate that the RH(T ) data of the LSCO system can be used as a template for the estimation of p. The resulting phase diagram of p vs Tc suggests that Tc is anomalously suppressed in the underdoped samples, becoming zero at around p ≃ 0.10, while the optimum Tc is achieved at p ≃ 0.16 as expected. "		7.42105263157895	25.3120567375886
PR06103808-CC.pdf	PR06103808-CC.pdf	c-Axis Superfluid Response and Pseudogap in High-T c Superconductors 	To gain insight into the out-of-plane electrodynamics of high-Tc superconductors we have measured the absolute val- ues and temperature dependence of the c-axis magnetic pen- etration depth λc(T ) for two typical single layer high-Tc cuprates, La2−xSrxCuO4 and HgBa2CuO4+x as a function of doping. A distinct change in the behaviour of λc is observed near 0.20 holes/Cu, which is related to the opening of the normal state pseudogap. The variation of λc with doping is qualitatively similar to that of the in-plane component, λ ab , which suggests that the c-axis superfluid response is mainly governed by the superconducting condensation energy. The strong doping dependence of λc(0) for p < 0.20 provides an explanation for the discrepancies in the literature. 		4.85714285714286	42.3529411764706
PR05009672-CC.pdf	PR05009672-CC.pdf	Anomalous Behavior of the Complex Conductivity of Y 1−x Pr x Ba 2 Cu 3 O 7 Observed with THz Spectroscopy Typeset using REVT E X 	We have measured the electrodynamic properties of Y 1−x Pr x Ba 2 Cu 3 O 7 single crystal thin films as a function of temperature using coherent THz-time-domain spectroscopy. We obtain directly the complex conductivity σ = σ 1 + iσ 2 , the London penetration depth λ L , the plasma frequency ω p , and the quasiparticle scattering rate 1/τ . We find that 1/τ drops exponentially rapidly with T below the critical temperature in all the superconducting samples, implying that this behavior is a signature of high- T c superconductivity. The plasma frequency decreases with increasing Pr content, providing evidence that Pr depletes carriers, leaving the CuO planes underdoped. Both the conductivity in the THz region and the dc resistivity yield evidence for the opening of a spin gap above T c . 		3.03703703703704	39.9756097560976
L090137002-CC.pdf	L090137002-CC.pdf	Role of pair-breaking and phase fluctuations in c-axis tunneling in underdoped Bi 2 Sr 2 CaCu 2 O 8+δ 	The Josephson Plasma Resonance is used to study the c-axis supercurrent in the superconducting state of under- doped Bi2Sr2CaCu2O 8+δ with varying degrees of controlled point-like disorder, introduced by high-energy electron irradiation. As disorder is increased, the Josephson Plasma frequency decreases proportionally to the critical tem- perature. The temperature dependence of the plasma frequency does not depend on the irradiation dose, and is in quantitative agreement with a model for quantum fluctuations of the superconducting phase in the CuO2 layers. 		1.07692307692308	79.0714285714286
SSC1310125-CC.pdf	SSC1310125-CC.pdf	Proton incorporations and superconductivity in a cobalt oxyhydrate 	We report the evidence of proton incorporations in a newly-discovered cobalt oxy- hydrate superconductor. During the hydration process for Na 0.32 CoO 2 by the direct reaction with water liquid, it was shown that substantial NaOH was gradually lib- erated, indicating that H + is incorporated into the hydrated compound. Combined with the thermogravimetric analysis, the chemical composition of the typical sample is Na 0.22 H 0.1 CoO 2 • 0.85H 2 O, which shows bulk superconductivity at 4.4 K. 		3.59090909090909	40.3670886075949
Liu_2018_Supercond._Sci._Technol._31_125011-CC.pdf	Liu_2018_Supercond._Sci._Technol._31_125011-CC.pdf	Superconductivity in SnSb with natural superlattice structure 	We report the results of electrical resistivity, magnetic and thermodynamic measurements on polycrystalline SnSb, whose structure consists of stacks of Sb bilayers and Sn 4 Sb 3 septuple layers along the c-axis. The material is found to be a weakly coupled, fully gapped, type-II superconductor with a bulk T c of 1.50 K, while showing a zero resistivity transition at a significantly higher temperature of 2.48 K. The Sommerfeld coefficient and upper critical field, obtained from specific heat measurements, are 2.29 mJ mol −1 K −2 and 520 Oe, respectively. Compositional inhomogeneity and strain effect at the grain boundaries are proposed as possible origins for the difference in resistive and bulk superconducting transitions. In addition, a comparison with the rock-salt structure SnAs superconductor is presented. Our results provide the first clear evidence of bulk superconductivity in a natural superlattice derived from a topological semimetal. 		6.41666666666667	30.5064935064935
