filename	link	title	abstract	keywords	entity_per_paragraphs	entity_per_tokens
L088227002-CC.pdf	L088227002-CC.pdf	Strongly Correlated s-Wave Superconductivity in the N-Type Infinite-Layer Cuprate 	Quasiparticle tunneling spectra of the electron-doped (n-type) infinite-layer cuprate Sr 0.9 La 0.1 CuO 2 reveal characteristics that counter a number of common phenomena in the hole-doped (p-type) cuprates. The optimally doped Sr 0.9 La 0.1 CuO 2 with T c 43 K exhibits a momentum-independent superconduct- ing gap D 13.0 6 1.0 meV that substantially exceeds the BCS value, and the spectral characteristics indicate insignificant quasiparticle damping by spin fluctuations and the absence of pseudogap. The re- sponse to quantum impurities in the Cu sites also differs fundamentally from that of the p-type cuprates with d x 2 2y 2 -wave pairing symmetry. 		5.88888888888889	34.3867924528302
L090137001-CC.pdf	L090137001-CC.pdf	Superconductivity of the Sr 2 Ca 12 Cu 24 O 41 spin ladder system : Are the superconducting pairing and the spin-gap formation of the same origin? 	Pressure-induced superconductivity in a spin-ladder cuprate Sr2Ca12Cu24O41 has not been studied on a microscopic level so far although the superconductivity was already discovered in 1996. We have improved high-pressure technique with using a large high-quality crystal, and succeeded in studying the superconductivity using 63 Cu nuclear magnetic resonance (NMR). We found that anomalous metallic state reflecting the spin-ladder structure is realized and the superconductivity possesses a s-wavelike character in the meaning that a finite gap exists in the quasi-particle excitation: At pressure of 3.5GPa we observed two excitation modes in the normal state from the relaxation rate T −1 1 . One gives rise to an activation-type component in T −1 1 , and the other T -linear component linking directly with the superconductivity. This gapless mode likely arises from free motion of holon-spinon bound states appearing by hole doping, and the pairing of them likely causes the superconductivity. 		2.82352941176471	63.6041666666667
JPS081113707-CC.pdf	JPS081113707-CC.pdf	Evidence of Inhomogeneous Superconductivity in FeTe 1-x Se x Thin Film Using Scotch-Tape Method 	We have fabricated thin films of FeTe 1-x Se x using a scotch-tape method. The superconductivities of the thin films are different from each other although these films were fabricated from the same bulk sample. The result clearly presents the inhomogeneous superconductivity in FeTe 1-x Se x . The difference comes from inhomogeneity due to the excess Fe concentration. The resistivity of a thin film with low excess Fe shows good superconductivity with the sharp superconducting-transition width and more isotropic superconductivity. 		4.9375	31.7088607594937
Suzuki_etal_2015-CC.pdf	Suzuki_etal_2015-CC.pdf	Pressure-Induced Superconductivity in BiS 2 -based EuFBiS 2 	We measured the electrical resistivity of the BiS 2 -based compound EuFBiS 2 under high pressure. Polycrystalline EuFBiS 2 shows insulator-metal transition and pressure-induced superconductivity above 0.7 GPa. The superconducting transition temperature increases with increasing applied pressure and shows a maximum value around 8.6 K at 1.8 GPa. 		6.69230769230769	16.2183908045977
PhysRevX.8.041024-CC.pdf	PhysRevX.8.041024-CC.pdf	Direct Visualization of the Nematic Superconductivity in Cu x Bi 2 Se 3 	Cu x Bi 2 Se 3 hosts both topological surface states and bulk superconductivity. It has been identified recently as a topological superconductor (TSC) with an extraordinary nematic, i.e., C 2 -symmetric superconducting state and odd-parity pairing. Here, using scanning tunneling microscopy, we directly examine the response of the superconductivity of Cu x Bi 2 Se 3 to magnetic field. Under out-of-plane fields (B ⊥ ), we discover elongated magnetic vortices hosting zero-bias conductance peaks consistent with the Majorana bound states expected in a TSC. Under in-plane fields (B = ), the average superconducting gap exhibits twofold symmetry with field orientation; the long C 2 symmetry axes are pinned to the dihedral mirror planes under B = ¼ 0.5 T but rotate slightly under B = ¼ 1.0 T. Moreover, a nodeless Δ 4x gap structure is semiquantitatively determined for the first time. Our data paint a microscopic picture of the nematic superconductivity in Cu x Bi 2 Se 3 and pose strong constraints on theory. 		1.52941176470588	126.615384615385
EPL0330153-CC.pdf	EPL0330153-CC.pdf	Linear Temperature Variation of the Penetration Depth in YBa 2 Cu 3 O 7−δ Thin Films 	We have measured the penetration depth λ(T ) on YBa 2 Cu 3 O 7 thin films from transmission at 120, 330 and 510 GHz, between 5 and 50 K. Our data yield simultaneously the absolute value and the temperature dependence of λ(T ). In high quality films λ(T ) exhibits the same linear temperature depen- dence as single crystals, showing its intrinsic nature, and λ(0) = 1750Å. In a lower quality one, the more usual T 2 dependence is found, and λ(0) = 3600Å. This suggests that the T 2 variation is of extrinsic origin. Our results put the d-wave like interpretation in a much better position. 		2.54545454545455	59.7142857142857
L089157004-CC.pdf	L089157004-CC.pdf	Superconductivity and Quantum Criticality in CeCoIn 5 	Electrical resistivity measurements on a single crystal of the heavy-fermion superconductor CeCoIn5 at pressures to 4.2 GPa reveal a strong crossover in transport properties near P * ≈ 1.6 GPa, where Tc is a maximum. The temperature-pressure phase diagram constructed from these data pro- vides a natural connection to cuprate physics, including the possible existence of a pseudogap. 		6.88888888888889	25.6854838709677
L095117006-CC.pdf	L095117006-CC.pdf	Pressure induced effects on the Fermi surface of superconducting 2H-NbSe 2 	The pressure dependence of the critical temperature T c and upper critical field H c2 (T ) has been measured up to 19 GPa in the layered superconducting material 2H-NbSe 2 . T c (P ) has a maximum at 10.5 GPa, well above the pressure for the suppression of the CDW order. Using an effective two band model to fit H c2 (T ), we obtain the pressure dependence of the anisotropy in the electron phonon coupling and Fermi velocities, which reveals the peculiar interplay between CDW order, Fermi surface complexity and superconductivity in this system. 		4	38.0434782608696
Carnicom_2018_Supercond._Sci._Technol._31_115005.pdf	Carnicom_2018_Supercond._Sci._Technol._31_115005.pdf	Superconductivity in the superhard boride WB 4.2 	We show that the superhard boride WB 4.2 is a superconductor with a T c of 2.05(5) K. Temperature-dependent magnetic susceptibility, electrical resistivity, and specific heat measurements were used to characterize the superconducting transition. The Sommerfeld constant γ for WB 4.2 is 2.07(3) mJ mol −1 K −2 and the ΔC/γT c =1.56, which is somewhat higher than what is expected for weakly coupled Bardeen-Cooper-Schrieffer type superconductors. The H c2 versus T plot is linear over a wide temperature range but does show signs of flattening by the lowest temperatures studied and therefore the zero temperature upper critical field (μ 0 H c2 (0) for WB 4.2 lies somewhere between the linear extrapolation of μ 0 H c2 (T) to 0 K and expectations based on the Werthamer-Helfand-Hohenberg model. 		5.96153846153846	29.058064516129
Li_2018_Supercond._Sci._Technol._31_085001.pdf	Li_2018_Supercond._Sci._Technol._31_085001.pdf	Superconductivity and phase diagram in a transition metal doped Zr 5 Ge 3 compound 	Systematic study of transition metal doped Zr 5 Ge 3 at different sites has been performed, and superconductivity only occurs with Pt doping at the Ge site. Superconductivity remains absent with other transition metal doping such as Y, Cr, Ir, and Pd at other different sites. Coincidental with our previous findings in the Zr 5 Ge 3−x Ru x system, it appears that the induced superconductivity is not only site-selective (only at the Ge site), but also dopant selective (only with Pt and Ru dopants). The bulk superconductivity in Zr 5 Ge 3−x Pt x is investigated through magnetization, electrical resistivity, and heat capacity measurement, and the superconducting phase diagram of Zr 5 Ge 3−x Pt x is also established. 		7.2	26.9166666666667
L094127001-CC.pdf	L094127001-CC.pdf	Muon-Spin-Rotation Measurements of the Penetration Depth in the Infinite-Layer Electron-Doped Cuprate Superconductor Sr 0.9 La 0.1 CuO 2 	Muon spin rotation (µSR) measurements of the in-plane penetration depth λ ab have been per- formed in the electron-doped infinite layer high-Tc superconductor (HTS) Sr0.9La0.1CuO2. Absence of the magnetic rare-earth ions in this compound allowed to measure for the first time the abso- lute value of λ ab (0) in electron-doped HTS using µSR. We found λ ab (0)=116(2) nm. The zero- temperature depolarization rate σ(0) ∝ 1/λ 2 ab (0)=4.6(1) µs −1 is more than four times higher than expected from the Uemura line. Therefore this electron-doped HTS does not follow the Uemura relation found for hole-doped HTS. 		5.76470588235294	37.5510204081633
L091087001-CC.pdf	L091087001-CC.pdf	Magnetic Penetration Depth Measurements of Pr 2−x Ce x CuO 4−δ Films on Buffered Substrates: Evidence for a Nodeless Gap 	We report measurements of the inverse squared magnetic penetration depth, λ −2 (T ), in Pr2−xCexCuO 4−δ (0.115 ≤ x ≤ 0.152) superconducting films grown on SrTiO3 (001) substrates coated with a buffer layer of insulating Pr2CuO4. λ −2 (0), Tc and normal-state resistivities of these films indicate that they are clean and homogeneous. Over a wide range of Ce doping, 0.124 ≤ x ≤ 0.144, λ −2 (T ) at low T is flat: it changes by less than 0.15% over a factor of 3 change in T , indicating a gap in the superconducting density of states. Fits to the first 5% decrease in λ −2 (T ) produce values of the minimum superconducting gap in the range of 0.29 ≤ ∆min/kBTc ≤ 1.01. 		4.18181818181818	37.6739130434783
Tanaka_etal_2017-CC.pdf	Tanaka_etal_2017-CC.pdf	"Superconductivity and its Enhancement under High Pressure in ""F-free"" Single Crystals of CeOBiS 2 "	"F-free"" CeOBiS2 single crystals have successfully grown, thoroughly eliminating a concern about F-contamination by using a high-purity CsCl flux. The obtained crystals have a plate-like shape with a size of 1.0-3.0 mm in the well-developed plane. Single crystal X-ray structural analysis clearly revealed that the CeOBiS2 crystallizes with a space group P4/nmm (with lattice parameters of a = 4.0189(6) Å, c = 13.573(2) Å). The bond valence sum estimation and X-ray photoelectron spectroscopy analysis showed that the chemical state of Ce was in the mixed valence of Ce 3+ and Ce 4+ . The single crystals show superconductivity with zero resistivity at ~1.3 K. This is the first conclusive evidence of superconductivity driven by Ce valence fluctuation in surely non-doped CeOBiS2. The superconducting transition temperature was enhanced up to ~3.8 K by applying hydrostatic pressure. "		5.35483870967742	36.8192771084337
L093156802-CC.pdf	L093156802-CC.pdf	Evidence for gap anisotropy in CaC 6 from directional point-contact spectroscopy 	We present the first results of directional point-contact spectroscopy in high quality CaC6 samples both along the ab plane and in the c-axis direction. The superconducting order parameter ∆(0), obtained by fitting the Andreev-reflection (AR) conductance curves at temperatures down to 400 mK with the single-band 3D Blonder-Tinkham-Klapwijk model, presents two different distributions in the two directions of the main current injection, peaked at 1.35 and 1.71 meV, respectively. By ab-initio calculations of the AR conductance spectra, we show that the experimental results are in good agreement with the recent predictions of gap anisotropy in CaC6. 		2.15	89.3953488372093
Drozdov_etal_2015.pdf	Drozdov_etal_2015.pdf	Conventional superconductivity at 203 kelvin at high pressures in the sulfur hydride system 			9.54545454545455	20.6412698412698
1903.04321-CC.pdf	1903.04321-CC.pdf	Enhanced, homogeneous type II superconductivity in Cu-intercalated PdTe 2 	175005 (H.P.) India Though the superconducting phase of the type-II Dirac semimetal PdTe2 was shown to be con- ventional in nature, the phase continued to be interesting in terms of its magnetic properties. While certain experiments indicated an unexpected type-I superconducting phase, other experiments re- vealed formation of vortices under the application of magnetic fields. Recently, scanning tunneling spectroscopy (STS) experiments revealed the existence of a mixed phase where type-I and type-II behaviours coexist. Here, based on our temperature and magnetic field dependent STS experiments on Cu-intercalated PdTe2 we show that as the critical temperature of the superconducting phase goes up from 1.7 K to 2.4 K on Cu-intercalation, the mixed phase disappears and the system be- comes homogeneously type-II. This may be attributed to an averaging effect caused by quasiparticle exchange between type-I and type-II domains mediated by the Cu atoms and to decreased coherence length due to increased disorder. 		5.46153846153846	48.8169014084507
SST01600L7-CC.pdf	SST01600L7-CC.pdf	Under-doped La 2−x Sr x CuO 4 with x = 0.063 -0.125: TSFZ growth of high-quality crystals and anomalous doping dependences of superconducting properties 	"A series of high-quality La2−xSrxCuO4 (LSCO) superconductor crystals in the under-doping region with x = 0.063, 0.07, 0.09, 0.10, 0.111 and 0.125 has been successfully prepared by traveling-solvent floating-zone (TSFZ) technique. The crystals are large and free of sub-grains and foreign phases. The high crystal quality has been revealed by double-crystal x-ray rocking curves and Rutherford backscattering spectrometry combined with ion- beam channeling effect. We find that the evolutions of the superconducting transition width and volume fraction as a function of carrier concentration exhibit interesting anomalies in the vicinity of some ""magic number"" doping levels such as x = 1/4 2 (=0.0625) and 1/3 2 (=0.111). We argue that these behaviours are of intrinsic electronic origin. "		4.33333333333333	45.6923076923077
sun2012re-emerging-CC.pdf	sun2012re-emerging-CC.pdf	Reemerging superconductivity at 48 K in iron chalcogenides 	Pressure plays an essential role in the induction 1 and control 2,3 of superconductivity in iron-based superconductors. Substitution of a large cation by a smaller rare-earth ion to simulate the pressure effects has raised the superconducting transition temperature T C to a record high of 55 K in these materials 4,5 . Analogous to the bell-shaped curve of T C dependence on chemical doping, pressure-tuned T C typically drops monotonically after passing the optimal pressure 1-3 . Here we report the observations of an unexpected phenomenon in superconducting iron chalcogenides that after the T C dropped from the maximum of 32 K at 1 GPa and vanished (< 4 K) above 9.5 GPa, a second superconducting region with considerably higher T C than the first maximum suddenly reemerged above 11.5 GPa. The T C of the reemerging superconducting phase reaches 48.0-48.7 K for Tl 0.6 Rb 0.4 Fe 1.67 Se 2 , K 0.8 Fe 1.7 Se 2 and K 0.8 Fe 1.78 Se 2 , setting a new T C record for iron chalcogenide superconductors. The recent discoveries of superconductivity at 30-32 K in a new family of iron-based chalcogenide superconductors 6-9 A 1-x Fe 2-y Se 2 (A=K, Rb or Cs, with possible Tl substitution) bring new excitement to the field of superconductivity 10 . Some of the most striking features of such superconductors include the unusually large magnetic moments up to 3.3  B per Fe atom and the Fe-vacancy ordering in the Fe square lattice 11 . How superconductivity with such a high T C can exist on such a strong magnetic background remains perplexing 10 . It has been established that the superconductivity in strongly correlated electronic systems can be dictated by their crystallographic structure, electronic charge, as well as orbital and spin degree of freedom, which in turn, can be manipulated by controlling parameters including pressure, magnetic field, and chemical composition 12-15 . Pressure is a 'clean' way to tune basic electronic and structural properties without changing the chemistry. High-pressure studies are thus very useful in elucidating mechanisms of superconductivity as well as in searching for new high-T C 		6.3	29.8571428571429
xing2014theAnomaly-CC.pdf	xing2014theAnomaly-CC.pdf	The anomaly Cu doping effects on LiFeAs superconductors 	The Cu substitution effect on the superconductivity of LiFeAs has been studied in comparison with Co/Ni substitution. It is found that the shrinking rate of the lattice parameter c for Cu substitution is much smaller than that of Co/Ni substitution. This is in conjugation with the observation of ARPES that shows almost the same electron and hole Fermi surfaces (FSs) size for undoped and Cu substituted LiFeAs sample, except for a very small hole band sinking below Fermi level with doping. This indicates that there is little doping effect at Fermi surface by Cu substitution, in sharp contrast to the more effective carrier doping effect by Ni or Co. 		4.63157894736842	38.7045454545454
yamaguchi2014ac.pdf	yamaguchi2014ac.pdf	AC Magnetic Measurement of LiFeAs at Pressures up to 5.2 GPa: the Relation between T c and the Structural Parameters 	The pressure effects on the 111-type Fe-based superconductor LiFeAs were investigated through AC susceptibility measurements and X-ray diffraction experiments, and revealed a correlation be- tween the superconducting transition temperature (Tc) and the As-Fe-As bond angle (α) rather than the height of As from the Fe layers (hAs). As the pressure was increased, Tc of 17 K at P = 0 GPa decreased down to 10 K at P = 5.2 GPa. According to a previous report from an X-ray diffraction experiment, α changes from 101.5 • at 0 GPa to 97.8 • at 17 GPa. The obtained change in Tc is consistent with Lee et al.'s plot of Tc as a function of α, and from this result, we conclude that Tc will fall to zero at around α = 98 • . 		7.71428571428571	17.5833333333333
kotegawa2008abrupt-CC.pdf	kotegawa2008abrupt-CC.pdf	Abrupt Emergence of Pressure-Induced Superconductivity of 34 K in SrFe 2 As 2 : A Resistivity Study under Pressure 	We report resistivity measurement under pressure in single crystals of SrFe2As2, which is one of the parent materials of Fe-based superconductors. The structural and antiferromagnetic (AFM) transition of T0 = 198 K at ambient pressure is suppressed under pressure, and the ordered phase disappears above Pc ∼ 3.6 − 3.7 GPa. Superconductivity with a sharp transition appears accompanied by the suppression of the AFM state. Tc exhibits a maximum of 34.1 K, which is realized close to the phase boundary at Pc. This Tc is the highest among those of the stoichiometric Fe-based superconductors. 		9.3125	20.2013422818792
mydeen2010temperature-CC.pdf	mydeen2010temperature-CC.pdf	Temperature -pressure phase diagram of the superconducting iron pnictide LiFeP 			6.23529411764706	30.2830188679245
piva2015combined-CC.pdf	piva2015combined-CC.pdf	Combined external pressure and Cu-substitution studies on BaFe 2 As 2 single crystals 	We report a combined study of external pressure and Cu-substitution on BaFe 2 As 2 single crystals grown by the in-flux technique. At ambient pressure, the Cu-substitution is known to suppress the spin density wave (SDW) phase in pure BaFe 2 As 2 (T SDW ≈ 140 K) and to induce a superconducting (SC) dome with a maximum transition temperature T max c 4.2 K. This T max c is much lower than the T c ∼ 15-28 K achieved in the case of Ru, Ni and Co substitutions. Such a lower T c is attributed to a Cu 2+ magnetic pair-breaking effect. The latter is strongly suppressed by applied pressure, as shown herein, T c can be significantly enhanced by applying high pressures. In this work, we investigated the pressure effects on Cu 2+ magnetic pair-breaking in the BaFe 2−x Cu x As 2 series. Around the optimal concentration (x opd = 0.11), all samples showed a substantial increase of T c as a function of pressure. Yet for those samples with a slightly higher doping level (over-doped regime), T c presented a dome-like shape with maximum T c 8 K. Remarkably interesting, the under-doped samples, e.g. x = 0.02 display a maximum pressure induced T c 30 K which is comparable to the maximum T c 's found for the pure compound under external pressures. Furthermore, the magnetoresistance effect as a function of pressure in the normal state of the x = 0.02 sample also presented an evolution consistent with the screening of the Cu 2+ local moments. These findings demonstrate that the Cu 2+ magnetic pair-breaking effect is completely suppressed by applying pressure in the low concentration regime of Cu 2+ substituted BaFe 2 As 2 . 		9.23076923076923	27.475
wang2011effect.pdf	wang2011effect.pdf	"Effect of pressure on a ""111""-type iron pnictide superconductor "	"The behavior of superconductivity of ""111""-type iron pnictide superconductors, namely, LiFeAs, NaFeAs and LiFeP, is investigated at different pressures through electrical resistance measurements. For LiFeAs and LiFeP, the superconducting transition temperature T c decreases monotonously with increasing pressure, with the pressure coefficient of dT c /dP being −1.38 and −1.26 K/GPa, respectively. The T c of NaFeAs increases to a maximum value with the pressure increasing to 3 GPa; further increasing the pressure suppresses T c with the slope of dT c /dP about −3.40 K/GPa. "		6.5	19.7032967032967
ivanovskii2008newHigh.pdf	ivanovskii2008newHigh.pdf	New high-temperature superconductors based on rare-earth and transition metal oxyarsenides and related phases: synthesis, properties, and simulations 	The discovery in February 2008 of superconductivity with the transition temperature about 26 K in fluorine-doped oxyarsenide LaO 1-x F x FeAs stimulated numerous studies of superconducting and other physical properties of this and re- lated materials, resulting in a new family of high-temperature (T c $ 26 ± 55 K) superconductors. The experimental and theo- retical state of the art is reviewed concerning the synthesis, properties, and simulation of the new family and related sys- tems. Magnetic characteristics; 3.3 Spectroscopic studies of oxyarsenide properties 4. Simulation of the band structure and properties of superconducting oxypnictides 1245 4.1 Band calculations; 4.2 Simulation of oxypnictide properties; 4.3 Theoretical models of superconductivity in oxypnictides 5. New superconductors based on ternary AFe 2 As 2 arsenides: the 122 phase 1251 5.1 Synthesis and crystal structure of 122 phases and superconducting materials based on them; 5.2 Superconductivity and magnetism; 5.3 Band structure simulation and the properties of 122 phases 6. Conclusion 1256 References 1257 Ã Maximum superconducting transition temperature (for a series of samples with variable composition). ÃÃ SPS is solid-phase synthesis. ÃÃÃ PC and SC are polycrystal and single crystal samples. ÃÃÃÃ Sc is semiconductor December 2008 New high-temperature superconductors: synthesis, properties, and simulations Ã Maximum superconducting transition temperature (for a series of variable-composition samples). ÃÃ SPS is solid-phase synthesis; reagents, temperature T and time t of thermal treatment are given. ÃÃÃ PC and SC are polycrystalline and single crystal samples. 		4.3546511627907	36.0373831775701
ying2011pressure-CC.pdf	ying2011pressure-CC.pdf	New Journal of Physics Pressure effect on superconductivity of A x Fe 2 Se 2 (A = K and Cs) 	We have performed high hydrostatic pressure resistivity measure- ments (up to 1.7 GPa) on the newly discovered superconductor A x Fe 2 Se 2 (A = K and Cs) single crystals. Two batches of single crystals K x Fe 2 Se 2 with different transition temperatures (T c ) were used to study the effect of pressure. The T c of the first one gradually decreases with increasing pressure from 32.6 K at ambient pressure. While a dome-like behavior was observed for the crystal with T c = 31.1 K, T c reaches its maximum value of 32.7 K at the pressure of 0.48 GPa. This indicates that there exists an optimal doping with maximum T c of 32.7 K in the K x Fe 2 Se 2 system. The behavior of T c versus pressure for Cs x Fe 2 Se 2 also shows a dome-like behavior, and T c reaches its maximum value of 31.1 K at a pressure of 0.82 GPa. The hump observed in the temperature dependence of resistivity for all of the samples tends to shift to high temperature with increasing pressure. The resistivity hump could arise from the vacancy of Fe or Se. 		15.5714285714286	12.954128440367
